{
  "kind": "cineweave_codex_shot_spec",
  "contractVersion": "2.2.0",
  "shotSpecId": "shot.rain-teahouse-table-turn-v1",
  "version": 1,
  "scriptSceneRef": {
    "kind": "cineweave_codex_script_scene",
    "id": "script-scene.rain-teahouse-escape",
    "version": 1,
    "contentHash": "sha256:1111111111111111111111111111111111111111111111111111111111111111"
  },
  "beatIds": ["beat.protection-revealed"],
  "actionSequenceRef": {
    "kind": "cineweave_codex_action_sequence_spec",
    "id": "action-sequence.rain-teahouse-escape-v1",
    "version": 1,
    "contentHash": "sha256:aaaaaaaaaaaaaaaaaaaaaaaaaaaaaaaaaaaaaaaaaaaaaaaaaaaaaaaaaaaaaaaa"
  },
  "actionBeatIds": ["action-beat.first-entry", "action-beat.stair-sealed"],
  "skillReceipt": {
    "repository": "https://github.com/Wilder1222/cineweave-studio",
    "ref": "v2.5.0",
    "commit": "0123456789abcdef0123456789abcdef01234567",
    "installedBy": "codex-environment",
    "usedAt": "2026-08-22T10:20:00.000Z"
  },
  "purpose": "让观众清楚看见顾行舟如何用长桌改变通道，并在楼梯追兵出现时失去原撤离路线。",
  "dramaticBeat": "顾行舟不拔刀地挡住第一轮推进，但新的追兵从楼梯落地，迫使他改选临河窗。",
  "audienceAttention": ["顾行舟双脚与湿木地面的支撑", "长桌由纵向转为横向", "追兵被压缩为单列", "楼梯侧新威胁进入"],
  "bindings": {
    "characters": [
      {
        "kind": "character_binding",
        "id": "binding.gu-xingzhou-teahouse-01",
        "version": 1,
        "contentHash": "sha256:5555555555555555555555555555555555555555555555555555555555555555"
      },
      {
        "kind": "character_binding",
        "id": "binding.shen-heng-teahouse-01",
        "version": 1,
        "contentHash": "sha256:7777777777777777777777777777777777777777777777777777777777777777"
      },
      {
        "kind": "character_binding",
        "id": "binding.pursuers-teahouse-01",
        "version": 1,
        "contentHash": "sha256:9999999999999999999999999999999999999999999999999999999999999999"
      }
    ],
    "scene": {
      "kind": "scene_binding",
      "id": "binding.scene-rain-teahouse-01",
      "version": 1,
      "contentHash": "sha256:2222222222222222222222222222222222222222222222222222222222222222"
    },
    "interactionConstraints": {
      "kind": "cineweave_codex_interaction_constraint_set",
      "id": "interaction.rain-teahouse-floor",
      "version": 1,
      "contentHash": "sha256:3333333333333333333333333333333333333333333333333333333333333333"
    }
  },
  "blocking": [
    {
      "subjectRef": "binding.gu-xingzhou-teahouse-01",
      "startZone": "茶楼中央，长桌内侧",
      "action": "避开清晰的兵器轨迹后短促推动桌沿，使长桌横置；听见楼梯落地声后停止追击并转移视线。",
      "endZone": "茶楼中央靠临河窗一侧",
      "eyeline": "先看正门追兵的手，再看楼梯脚，最后确认临河窗。",
      "weightAndContact": "右脚先落稳，后脚为推桌提供支撑，整个动作中双脚与湿木地面接触可读。"
    },
    {
      "subjectRef": "binding.shen-heng-teahouse-01",
      "startZone": "柜台外侧阴影",
      "action": "抱紧账册并沿顾行舟身后保留的空间向临河窗方向移动一步。",
      "endZone": "柜台与临河窗之间",
      "eyeline": "先看长桌碰撞，再跟随顾行舟视线看到楼梯追兵。",
      "weightAndContact": "动作带有未受训练的迟疑，后脚确认湿地后才转移重量。"
    },
    {
      "subjectRef": "binding.pursuers-teahouse-01",
      "startZone": "正门与楼梯脚",
      "action": "正门两人被横桌迫使改单列，楼梯追兵从侧后进入但不穿越桌体或同伴。",
      "endZone": "长桌两端与楼梯脚形成夹压",
      "eyeline": "集中在顾行舟和他身后的账册。",
      "weightAndContact": "三人位置和前后间距保持可读，落地与急停均有明确支撑。"
    }
  ],
  "camera": {
    "shotScale": "三人以上的中远景覆盖",
    "position": "茶楼南侧柱间，能同时看到正门、长桌、楼梯脚和临河窗方向",
    "height": "成人胸口略下",
    "angle": "斜看长桌，使桌体转向前后的通道宽度都可判断",
    "focalLengthMm": 35,
    "perspectiveIntent": "保留狭窄室内的真实纵深和桌体位移，不用长焦压平人物间距。",
    "focusTarget": "顾行舟与长桌接触处；楼梯追兵落地后景深仍允许其可读。",
    "depthOfField": "中等景深，脚下支撑、桌端和楼梯威胁均清楚。",
    "axisSide": "保持在正门—临河窗主行动轴南侧。",
    "movementIntent": "以稳定覆盖为主，只在长桌完成横置时小幅向临河窗方向修正，动机是保留保护线和新通道。"
  },
  "composition": {
    "layout": "长桌形成中景斜线，顾行舟位于线内侧，沈蘅在其后，正门与楼梯追兵从两端形成压力。",
    "foreground": "南侧柱边与少量未受影响的茶具",
    "midground": "顾行舟、横置长桌和沈蘅",
    "background": "正门追兵、楼梯脚与临河窗方向",
    "negativeSpace": "顾行舟身后保留一条通向临河窗的窄空带",
    "visualHierarchy": "脚下支撑和桌沿接触先于追兵路径，楼梯威胁最后改变观众判断。"
  },
  "performanceTimelineRefs": [
    {
      "kind": "cineweave_codex_performance_timeline",
      "id": "performance.gu-xingzhou-teahouse-v1",
      "version": 1,
      "contentHash": "sha256:6666666666666666666666666666666666666666666666666666666666666666"
    },
    {
      "kind": "cineweave_codex_performance_timeline",
      "id": "performance.shen-heng-teahouse-v1",
      "version": 1,
      "contentHash": "sha256:8888888888888888888888888888888888888888888888888888888888888888"
    }
  ],
  "actionMoment": "长桌刚完成横置，正门追兵被迫收窄队形，楼梯追兵恰好进入画面并封住后路。",
  "endState": "顾行舟仍未拔刀；沈蘅向临河窗移动一步；长桌横置；两路追兵形成新的夹压。",
  "continuity": ["长桌从本镜结束起保持横置", "顾行舟位于沈蘅与追兵之间", "顾行舟的刀仍在右侧鞘内", "主行动轴南侧不变", "楼梯追兵不得瞬移到临河窗外"],
  "promptHandoff": {
    "primaryTarget": "顾行舟用横置长桌改变追兵路线后发现楼梯退路被封的动作转折",
    "mustPreserve": ["ActionSequenceSpec 的两个精确节拍", "三组 CharacterBinding", "SceneBinding 与 InteractionConstraintSet", "脚—桌—追兵路径因果", "35mm 人体尺度地理"],
    "mayVary": ["前景柱边裁切", "倒下茶具的细节", "摄影机小幅修正距离"],
    "unresolved": ["镜头最终时长与具体表演秒点由 TemporalSpec 对齐"],
    "actionBreakdown": {
      "weaponDetails": [
        {
          "weaponRef": "weapon.pursuer-dao",
          "name": "制式单刀",
          "type": "单刃短刀，近距离劈砍型兵器",
          "characteristics": ["窄长单刃、厚刀背", "深色缠带刀柄", "只保留短促冷色金属反光"],
          "currentState": "前景追兵右手持刀，刀锋从画面左上向右下斜落后收住。"
        }
      ],
      "technique": "追兵使用斜劈压线：前脚跨入、肩线带动持刀臂，意在逼退；顾行舟以侧闪卸线让开刀路，随后不追击而借桌转位。",
      "trajectory": "刀锋从追兵右肩外侧的高位起，经画面左上至右下的斜线，在顾行舟左肩外侧的前景空位收住；顾行舟左脚向画面右侧短移，双手再沿长桌近端作短弧推动，桌体由纵深方向转为横向。",
      "exchange": "追兵发起斜劈压线 → 顾行舟侧闪卸线并保持沈蘅身前保护位 → 顾行舟以借桌转位反制通道 → 追兵由并列推进被迫改单列，主动权短暂转移。",
      "contactAndResult": "制式单刀与人体无接触，属于可读 near miss；唯一接触是顾行舟与长桌的 prop contact，动作结果是通道被横桌切断而非人物受伤。",
      "continuity": "顾行舟仍未拔出右侧窄身佩刀，刀具不进入本拍；长桌从本拍结束起保持横置，顾行舟仍在沈蘅与追兵之间，主行动轴保持在南侧。"
    }
  },
  "validation": {
    "onePurpose": true,
    "oneDominantCameraIdea": true,
    "bindingsExact": true,
    "axisCoherent": true,
    "actionPlayable": true,
    "endStateStable": true
  }
}
